Type,Question,Tags,Correct,Answers,,
category,Ordnen Sie sinnvoll zu,Natur;Flora;Fauna,,Bäume|||Esche;Kastanie,Fische|||Flunder,
order,Ordnen Sie die Begriffe alphabetisch,Alphabet,,1) Baum,2) Fisch,3) Zebra
number,Geben Sie die ersten drei Nachkommastellen von Pi an,Pi,,,,
text,Wie hieß Luther mit Vornamen,Reformation;Vorname;Martin,1,,,
match,Ordnen Sie einem jeden Begriff sein Gegenteil zu,Antonym;Gegenteil,,Weiß – Schwarz,Hell – dunkel,
multi,Was sind Vornamen von Precht?,Philosophen,2;3,Martin,Richard,David
single,Wer wurde 2014 Fußballweltmeister?,Fußball;WM,2,Argentinien,Deutschland,Brasilien
